{
  "refs": {
    "character": "角色图",
    "audio": ["参考音频"]
  },
  "shotSize": "medium-close-up",
  "subject": "林见微伸手触碰旋转的夜空，星辰如油画颜料在天空流动",
  "scene": "画中世界：厚重油画笔触构成的旋转星空，麦田延伸至脚下",
  "action": "她抬头看天空缓慢旋转，星辰像一团团被推开的颜料；她伸手去触碰天上的星纹，指尖几乎触到光芒",
  "camera": "中近景→面部特写推镜，仰拍视角",
  "style": "梵高星空厚涂质感，星辰旋转但保留笔触纹理，不CGI",
  "audioDesign": "Chorus人声在高潮中铺开，巨大的温暖空间感",
  "segments": [
    {"timeRange": "0-5秒", "content": "旋转的星空，星辰像被推开的厚涂颜料缓缓流动"},
    {"timeRange": "5-10秒", "content": "林见微伸手触碰天上的星纹，星光在她指尖很近的地方闪烁"}
  ]
}
