{
  "refs": {
    "character": "角色图",
    "audio": ["参考音频"]
  },
  "shotSize": "medium-close-up",
  "subject": "林见微低头继续画画，一束有些蔫掉的向日葵",
  "scene": "画室窗边，玻璃窗外有模糊人影偶尔走过，桌上向日葵照片",
  "action": "她对外界毫无反应，专注补画布上向日葵的金色；现实中的蔫向日葵轻轻抬起头来",
  "camera": "中近景，镜头从她侧脸缓慢摇向桌上向日葵，再摇回画布",
  "style": "冷调现实，从灰暗缓慢渗透暖色，安静克制",
  "audioDesign": "人声保持亲密诉说感，窗外环境音隔着厚雾",
  "segments": [
    {"timeRange": "0-6秒", "content": "林见微低头画画，窗外的模糊人影走过，她毫无反应"},
    {"timeRange": "6-12秒", "content": "她为画布上的向日葵补上一层金色，现实中蔫掉的向日葵轻轻抬起头来"}
  ]
}
