{
  "refs": {
    "character": "角色图",
    "audio": ["参考音频"]
  },
  "shotSize": "close-up",
  "subject": "林见微轻轻闭眼，像终于允许自己漂浮起来",
  "scene": "画室，温柔的光线环绕",
  "action": "她轻轻闭上眼睛，神情极度平静释然，像终于允许自己漂浮在什么里面；整个人有一层极淡的暖金色光晕",
  "camera": "面部特写，极其缓慢地停留",
  "style": "全片最柔软的一刻，温暖金调，油画般的光晕",
  "segments": [
    {"timeRange": "0-4秒", "content": "她轻轻闭上眼睛"},
    {"timeRange": "4-8秒", "content": "神情极度平静释然，像漂浮在温暖的光里，有一层极淡的暖金色光晕"}
  ]
}
