{
  "refs": {
    "character": "角色图",
    "audio": ["参考音频"]
  },
  "shotSize": "medium",
  "subject": "空无一人的画室，椅子空着，画笔放在桌边",
  "scene": "画室恢复安静，窗外天色已晚",
  "action": "画室恢复安静，椅子空着没人坐，画笔整齐放在桌边；傍晚光线从窗外照入；墙上有一幅画正在非常缓慢地流动，像仍有生命",
  "camera": "中景缓慢平移，扫过空椅、桌面、墙上的画",
  "style": "冷灰蓝色调回归，但留有一点温暖的余晖，物是人非",
  "segments": [
    {"timeRange": "0-6秒", "content": "画室安静，椅子空着没人坐，天色已晚"},
    {"timeRange": "6-12秒", "content": "墙上一幅画仍在极其缓慢地流动，像仍有生命"}
  ]
}
