{
  "refs": {
    "character": "角色图",
    "audio": ["参考音频"]
  },
  "shotSize": "medium-close-up",
  "subject": "林见微，桌上的玻璃水杯插着几支画笔，像漂浮的小船",
  "scene": "画室，金色已从画框蔓延到桌面边缘，空间有轻微不真实感",
  "action": "她安静地看着画，水杯里的画笔似有微微浮动；整个空间仍然安静但已被轻轻扭动",
  "camera": "中近景，缓慢的推镜头，从桌面水杯摇向她安静的侧脸",
  "style": "超现实感极轻微地侵入现实，油画肌理开始在物体表面浮现",
  "audioDesign": "人声叠在空灵的pad上，空间感缓缓拉开",
  "segments": [
    {"timeRange": "0-4秒", "content": "玻璃水杯里的画笔安静漂浮，像小船"},
    {"timeRange": "4-8秒", "content": "林见微安静注视画布，周围空间有极轻微的不真实感，但整体仍然安静"}
  ]
}
