{
  "refs": {
    "character": "角色图",
    "audio": ["参考音频"]
  },
  "shotSize": "wide",
  "subject": "整片星空麦田的全貌，林见微已化为画的一部分",
  "scene": "画中世界全貌：旋转的夜空，流淌的金色麦田，河流般的笔触",
  "action": "镜头极慢拉远，观众才看清整片夜空的旋转轨迹、麦田的走势、河流般的笔触，全部是由她身体延展开来；她不再是画家与画，她自己就是那幅画",
  "camera": "从近景极慢拉远至超大远景",
  "style": "全片视觉高潮，油画全景，她的轮廓与画布边界完全融合",
  "segments": [
    {"timeRange": "0-4秒", "content": "镜头开始拉远，她的身体与星空麦田连为一体"},
    {"timeRange": "4-8秒", "content": "全景展现：整片星空和麦田都是由她延展而成，她就是那幅画"}
  ]
}
