{
  "refs": {
    "character": "角色图",
    "audio": ["参考音频"]
  },
  "shotSize": "extreme-close-up",
  "subject": "林见微的眼睛，瞳孔中映出极淡的旋转星空",
  "scene": "画室窗边，傍晚光线",
  "action": "镜头极慢推近她的脸，靠近她的眼睛；她的瞳孔里映出一整片极淡的旋转星空，像夜空的微光缩成了瞳孔大小",
  "camera": "极致特写极慢推镜，最终整个画面只有一只眼睛",
  "style": "极近特写，温暖柔软，她已经带着那片星空",
  "segments": [
    {"timeRange": "0-4秒", "content": "镜头推近林见微的脸"},
    {"timeRange": "4-8秒", "content": "极致特写：她瞳孔中映出一整片极淡的旋转星空"}
  ]
}
