{
  "refs": {
    "character": "角色图",
    "audio": ["参考音频"]
  },
  "shotSize": "close-up",
  "subject": "林见微的脸，脸侧有一道淡蓝色颜料痕迹",
  "scene": "画室，颜料沾在她脸侧",
  "action": "她用手背轻轻蹭掉脸侧的颜料，反而蹭出一道淡蓝色痕迹；镜头贴近眼睛，瞳孔里出现极淡的旋转星空",
  "camera": "面部特写极缓慢推镜，直到充满整个画面的是她的眼睛",
  "style": "超现实克制的第一刻，瞳孔深处旋转星空极淡极轻",
  "audioDesign": "气息声加重，Pre-Chorus的温暖亲密感",
  "segments": [
    {"timeRange": "0-5秒", "content": "她用手背蹭掉脸侧的颜料，反而在皮肤上留下一道淡蓝色痕迹"},
    {"timeRange": "5-10秒", "content": "镜头贴近她的眼睛，瞳孔深处映出极淡的旋转星空微光"}
  ]
}
