{
  "refs": {
    "character": "角色图",
    "audio": ["参考音频"]
  },
  "shotSize": "medium",
  "subject": "画室墙面挂着的画开始流动，一缕蓝金交织的笔触",
  "scene": "画室，墙上的画边缘轻微流动，画布上的颜料开始活过来",
  "action": "一缕深蓝与金黄交织的油画笔触从画布中流出来，像一条小河蜿蜒向窗外蔓延",
  "camera": "中景固定镜头，跟拍笔触从画布到窗台的流动路径",
  "style": "超现实开始扩展，但仍然保留油画厚涂质感，不CGI感",
  "audioDesign": "旋律推向Pre-Chorus高潮，伴随颜料流动的微妙声音",
  "segments": [
    {"timeRange": "0-4秒", "content": "墙上挂着的画作边缘开始轻微流动"},
    {"timeRange": "4-8秒", "content": "一缕深蓝与金黄交织的油画笔触从画布中流出来，蜿蜒向窗外"}
  ]
}
