{
  "refs": {
    "character": "角色图",
    "audio": ["参考音频"]
  },
  "shotSize": "medium",
  "subject": "林见微，深色高领毛衣的年轻女孩，神情很淡",
  "scene": "窗边画架前，散着颜料和向日葵照片，窗外是灰白城市",
  "action": "她正安静地画一幅带梵高气息的画：树和金色笔触，唱到关键词时用手指轻轻抹开一笔金黄",
  "camera": "中景固定镜头，风吹动窗帘轻轻飘动",
  "style": "冷灰蓝现实调，柔软自然光，油画肌理感",
  "audioDesign": "Close-mic whisper式人声，极轻微画刷声",
  "segments": [
    {"timeRange": "0-5秒", "content": "林见微坐在窗边画架前安静画画，神情很淡"},
    {"timeRange": "5-10秒", "content": "她用手指轻轻抹开画布上一笔金黄，画上的树梢漫出温度感，窗外一根真实树枝慢慢染上金色"}
  ]
}
