{
  "refs": {
    "character": "角色图",
    "audio": ["参考音频"]
  },
  "shotSize": "medium",
  "subject": "林见微坐回窗边画架前，一只耳边垂落碎发",
  "scene": "画室恢复现实感，窗外的城市声音模糊遥远",
  "action": "她轻轻偏过头，仿佛主动隔绝外界声音；世界重新安静，只有窗外人影和车流的模糊影子",
  "camera": "中景，固定机位，缓慢的呼吸感推拉",
  "style": "现实冷灰色调回归，安静克制",
  "audioDesign": "Verse 2 人声回归亲密诉说感，吉他和缓进入",
  "segments": [
    {"timeRange": "0-5秒", "content": "画室重新安静，林见微坐回窗边，世界恢复现实冷灰色调"},
    {"timeRange": "5-10秒", "content": "她轻轻偏过头，碎发垂在耳边，隔绝外界杂音，窗外人影模糊遥远"}
  ]
}
