{
  "refs": {
    "character": "角色图",
    "audio": ["参考音频"]
  },
  "shotSize": "medium-close-up",
  "subject": "林见微重新站回画架前，画室墙面开始肌理化",
  "scene": "画室，墙壁、桌面、窗框慢慢呈现出厚油画笔触感",
  "action": "她重新站回画架前；环顾四周，墙壁桌面窗框正缓慢变成油画质地；她的指尖、手腕、衣袖边缘开始轻微颜料化",
  "camera": "中近景，从她手指的特写缓慢拉远展现环境变化",
  "style": "现实被油画质感覆盖，超现实再次出现但已无法逆转",
  "segments": [
    {"timeRange": "0-5秒", "content": "林见微站回画架前，画室墙面桌面开始浮现油画笔触纹理"},
    {"timeRange": "5-9秒", "content": "她的指尖和手腕开始轻微颜料化，衣袖边缘溶解成笔触"}
  ]
}
