{
  "refs": {
    "character": "角色图",
    "audio": ["参考音频"]
  },
  "shotSize": "wide",
  "subject": "林见微站在蓝色夜空与金色麦田交界处",
  "scene": "超现实：星空下的麦田，厚重油画笔触构成的天与地，不再是画室",
  "action": "镜头穿过她的画，她不再在画室，而是站在这片夜空与麦田之间；头发和衣角被风吹起，整个人非常轻",
  "camera": "一镜到底，镜头从画布上穿进去，变为全景展现画中世界",
  "style": "油画质感超现实，梵高笔触风格的星空与麦田，厚重颜料纹理",
  "audioDesign": "Chorus第一声入，大混响空间瞬间打开",
  "segments": [
    {"timeRange": "0-5秒", "content": "镜头穿进画布，画室消失"},
    {"timeRange": "5-10秒", "content": "林见微站在蓝色夜空与金色麦田的交界，头发衣角被风吹起，整个人轻盈如画中一部分"}
  ]
}
