{
  "refs": {
    "character": "角色图",
    "audio": ["参考音频"]
  },
  "shotSize": "medium-close-up",
  "subject": "林见微抬手作画，天空跟着她的手势被重新涂抹",
  "scene": "夜空麦田交界",
  "action": "她抬手作画，天空中的星辰跟着她的手势被重新涂抹和推动；旋转加快，她的发梢与衣角逐渐分解为细碎的金色和蓝色笔触，消散在风中",
  "camera": "中近景，从她的手摇向天空再摇回她正在分解的轮廓",
  "style": "笔触分解效果，厚重油彩风格，她正在变成画的一部分",
  "segments": [
    {"timeRange": "0-5秒", "content": "她抬手作画，天空的星辰跟着她的手势被重新涂抹旋转"},
    {"timeRange": "5-10秒", "content": "她的发梢与衣角逐渐分解为金色和蓝色的细碎笔触，消散在风里"}
  ]
}
