{
  "refs": {
    "character": "角色图",
    "audio": ["参考音频"]
  },
  "shotSize": "medium-close-up",
  "subject": "一群飞鸟从林见微身旁掠过，穿过她的身体",
  "scene": "画中世界：星空下鸟群飞过金色麦田",
  "action": "一群飞鸟从她身旁掠过，穿过她的肩膀和身体；她没有受伤，鸟群穿过的部分化成一束束深蓝、金黄、白色的颜料纹理；她脸上出现一丝非常轻的释然表情",
  "camera": "中近景，慢速捕捉鸟群穿过她身体的瞬间",
  "style": "超现实但安静不惊悚，她正在分解为画的元素",
  "segments": [
    {"timeRange": "0-5秒", "content": "鸟群从她身旁掠过，穿过她的肩膀和身体"},
    {"timeRange": "5-9秒", "content": "鸟群穿过的地方化成一束束颜料纹理，她脸上浮现一丝释然"}
  ]
}
