{
  "refs": {
    "character": "角色图",
    "audio": ["参考音频"]
  },
  "shotSize": "medium-close-up",
  "subject": "林见微胸口飘出一团黑蓝色颜料，落成一片鸢尾花",
  "scene": "画中世界：星空下的麦田与花丛",
  "action": "她的胸口飘出一团黑蓝色颜料，落在地上蔓延展开，生长出一片蓝紫色的鸢尾花；她站在花中，神情依旧安静，但眼里有被击中的光",
  "camera": "中近景固定，镜头微微下沉跟随颜料落地",
  "style": "油画厚涂质感的蓝紫色鸢尾花，浓郁色彩但安静不喧哗",
  "audioDesign": "Chorus第二句，温暖混响持续",
  "segments": [
    {"timeRange": "0-5秒", "content": "一团黑蓝色颜料从她胸口飘出，缓缓落地"},
    {"timeRange": "5-9秒", "content": "颜料落地蔓延，生长出一片蓝紫色鸢尾花，她站在花中，眼神第一次被击中"}
  ]
}
