{
  "refs": {
    "character": "角色图",
    "audio": ["参考音频"]
  },
  "shotSize": "close-up",
  "subject": "林见微的手掌抚过画布，星空顺着她的手爬上手臂",
  "scene": "画室已变成蓝黄交织的画中空间，不再是现实房间",
  "action": "她用手抚过画布，画布上的旋转星空顺着她的手掌爬上整条手臂；她抬眼看镜头，神情悲伤但平静；整个房间已经变成蓝黄交织的流动画布",
  "camera": "面部特写，镜头从手抚画布摇向她的眼睛",
  "style": "现实被完全吞没，但仍然是油画质感而非CG特效",
  "segments": [
    {"timeRange": "0-6秒", "content": "她抚过画布，旋转星空从画布爬上她的手臂"},
    {"timeRange": "6-12秒", "content": "她抬眼看镜头，悲伤但平静，整个房间已是蓝黄交织的流动油画"}
  ]
}
