{
  "refs": {
    "audio": ["参考音频"]
  },
  "shotSize": "extreme-close-up",
  "subject": "粗糙画布纤维，浅黄色油画颜料，沾着颜料的手指",
  "scene": "画室，冷灰蓝色调，只有一丝清晨冷光",
  "action": "画刷在画布上缓慢摩擦后静止，手指悬停在画布前，迟迟没有落下",
  "camera": "极致特写固定镜头，极其缓慢地聚焦在画布纹理与手指之间",
  "style": "油画质感，冷现实调，安静克制，极简留白",
  "audioDesign": "毛毡钢琴闷音，画刷摩擦画布的沙沙声，安静到近乎屏息",
  "segments": [
    {"timeRange": "0-4秒", "content": "黑场中先听见画刷摩擦画布的声音"},
    {"timeRange": "4-8秒", "content": "极近特写：画布纤维纹理，浅黄色颜料缓缓抹开"},
    {"timeRange": "8-12秒", "content": "沾着颜料的手指悬在画布前，定格不动，冷天晨光浅浅照亮手指边缘"}
  ]
}
