{
  "refs": {
    "audio": ["参考音频"]
  },
  "shotSize": "close-up",
  "subject": "空白画布上，一笔金黄色颜料自己慢慢旋开",
  "scene": "画室，安静空旷",
  "action": "画面切到空白画布；一笔小小的金黄色油画颜料在画布上自己慢慢旋开，像星轨也像一朵花打开",
  "camera": "固定镜头，只看着那笔颜料旋开，然后黑场",
  "style": "极度克制，只留一笔金黄色自己旋开，然后黑场",
  "audioDesign": "毛毡钢琴缓缓淡出，黑胶底噪渐弱，留白十秒",
  "segments": [
    {"timeRange": "0-3秒", "content": "空白画布上，一笔金黄色颜料自己慢慢旋开"},
    {"timeRange": "3-6秒", "content": "金黄色缓缓扩散成螺旋轨迹，然后黑场"}
  ]
}
