{
  "refs": {
    "character": "角色图",
    "audio": ["参考音频"]
  },
  "shotSize": "close-up",
  "subject": "林见微第一次抬眼，眼里倒映出很亮的金色",
  "scene": "画室画架前，金色光芒逐渐亮起",
  "action": "她抬眼看向画面，神情有一点空和疲惫；画上的金色开始轻微溢出画框，沿着画架木质边缘蔓延",
  "camera": "面部特写推镜，缓慢推近她的眼睛",
  "style": "超现实缓慢侵入，但克制不夸张，冷灰蓝底上金色渗入",
  "audioDesign": "呼吸感人声，画室安静中空间感微变",
  "segments": [
    {"timeRange": "0-5秒", "content": "林见微抬眼看向自己的画，眼里倒映出很亮的金黄色"},
    {"timeRange": "5-10秒", "content": "画上的金色缓慢溢出画框边缘，沿着木质画架蔓延"}
  ]
}
