{
  "refs": {
    "character": "角色图",
    "audio": ["参考音频"]
  },
  "shotSize": "close-up",
  "subject": "窗台花盆边的泥土，一株鸢尾花幼芽",
  "scene": "画室窗台，泥土中钻出新芽",
  "action": "镜头贴近花盆边泥土，一株鸢尾花幼芽慢慢拱出泥土；林见微蹲下来看它，神情非常轻近乎怜惜",
  "camera": "面部特写与幼芽特写交替，极慢的摇镜",
  "style": "现实冷调中透出一点生命力，柔软自然光",
  "segments": [
    {"timeRange": "0-4秒", "content": "泥土中一株鸢尾花幼芽慢慢拱出来"},
    {"timeRange": "4-7秒", "content": "林见微蹲下来看它，神情非常轻，近乎怜惜"}
  ]
}
