{
  "refs": {
    "character": "角色图",
    "audio": ["参考音频"]
  },
  "shotSize": "medium",
  "subject": "一整排靠墙的画架，所有画面朝墙",
  "scene": "画室角落",
  "action": "她转身看向墙边一整排靠着的画，所有画面朝墙看不见内容；镜头反转，原来那些画中藏着一整个明亮盛夏——向日葵、麦田、光与风",
  "camera": "中景→环绕摇镜，镜头从画背面转到画正面",
  "style": "从冷灰色调切到明亮的金黄暖色，强烈对比",
  "segments": [
    {"timeRange": "0-4秒", "content": "她看着墙边一排面朝墙壁的画"},
    {"timeRange": "4-8秒", "content": "镜头反转，画中是一整片明亮盛夏：金色向日葵、麦田、阳光与风"}
  ]
}
