{
  "refs": {
    "character": "角色图",
    "audio": ["参考音频"]
  },
  "shotSize": "wide",
  "subject": "麦田向天空疯长，金色枝条像燃烧的笔触，一群黑鸟掠过",
  "scene": "画中世界：星空下金色麦田延伸到天际，长出燃烧状的枝桠",
  "action": "麦田向天空生长，枝条像燃烧的金色油画笔触；一群黑鸟掠过整个画面；麦田在她身后像金黄色悬崖一样立起",
  "camera": "全景宽镜头，从低角度仰拍麦田生长的动态",
  "style": "梵高笔触式燃烧感，金黄色与深蓝夜空强烈对比，厚重油画肌理",
  "segments": [
    {"timeRange": "0-5秒", "content": "麦田向天空生长，枝条变成燃烧状的金色笔触向上蔓延"},
    {"timeRange": "5-9秒", "content": "一群黑鸟掠过画面，金色麦田在她身后像悬崖般立起"}
  ]
}
