{
  "refs": {
    "character": "角色图",
    "audio": ["参考音频"]
  },
  "shotSize": "full",
  "subject": "林见微走在金黄色的麦田中，脚下长出蓝绿交织的花草",
  "scene": "画中世界：星空旋转在头顶，金色麦田延伸到天际",
  "action": "她走在麦田里，每走一步脚下都长出金黄与蓝绿色交织的花草；头顶是厚重油画笔触构成的旋转夜空",
  "camera": "全景跟拍，镜头平行跟随她走过麦田",
  "style": "梵高笔触质感，强烈色彩对比，厚重颜料纹理",
  "segments": [
    {"timeRange": "0-5秒", "content": "林见微走在无边金色麦田中，头顶是旋转的星空"},
    {"timeRange": "5-11秒", "content": "她每走一步，脚下都生长出金黄与蓝绿交织的花朵和草地"}
  ]
}
